{
  "schema_version": "1.0",
  "job_id": "job-demo-defect-0004",
  "automation_rate": {
    "value": null,
    "numerator": 7,
    "denominator": 9,
    "data_complete": false
  },
  "nodes": [
    {
      "name": "req_parse",
      "status": "completed"
    },
    {
      "name": "code_scan",
      "status": "completed"
    },
    {
      "name": "interface_reconstruct",
      "status": "completed"
    },
    {
      "name": "code_review",
      "status": "completed"
    },
    {
      "name": "testcase_generate",
      "status": "completed"
    },
    {
      "name": "auto_execute",
      "status": "completed"
    },
    {
      "name": "test_report",
      "status": "completed"
    },
    {
      "name": "defect_list",
      "status": "manual_intervention",
      "intervention_reason": "未执行（本报告时点流水线尚未到达该节点）"
    },
    {
      "name": "retest_regression",
      "status": "manual_intervention",
      "intervention_reason": "未执行（本报告时点流水线尚未到达该节点）"
    }
  ]
}